<?xml version="1.0" encoding="UTF-8"?>

<!-- New XML document created with EditiX XML Editor (http://www.editix.com) at Tue Mar 23 13:55:31 WET 2021 -->

<clinica xmlns="http://www.misitio.com" 
xmlns:xsi="http://www.w3.org/2001/XMLSchema-instance" 
xsi:schemaLocation="http://www.misitio.com 14.xsd">
	<paciente>
		<nombre>Luis</nombre>
		<apellido>Trujillo</apellido>
		<visitante>
			<nombre>Maria</nombre>
			<apellido>Li</apellido>
		</visitante>
	</paciente>
	<paciente>
		<nombre>Lola</nombre>
		<apellido>Flores</apellido>
		<visitante>
			<nombre>Mariano</nombre>
			<apellido>Perez</apellido>
		</visitante>
		<visitante>
			<nombre>Nino</nombre>
			<apellido>Vargas</apellido>
		</visitante>
	</paciente>
		<paciente>
		<nombre>Wanda</nombre>
		<apellido>Maximoff</apellido>
	</paciente>
</clinica>
